<?xml version = "1.0" encoding = "UTF-8"?>
<ns0:ConversionInfo xmlns:ns0 = "http://www.tibco.com/schemas/Tibco2MuleAccelerator/Resources/Schema/Tibco/Conversion.xsd" xmlns:xsi = "http://www.w3.org/2001/XMLSchema-instance" xsi:schemaLocation = "http://www.tibco.com/schemas/Tibco2MuleAccelerator/Resources/Schema/Tibco/Conversion.xsd ../Schema/Tibco/Conversion.xsd">
	<ns0:conversion>
		<ns0:tibcoType>Start</ns0:tibcoType>
		<ns0:muleType>N/A</ns0:muleType>
		<ns0:conversionImpl>N/A</ns0:conversionImpl>
	</ns0:conversion>
	<ns0:conversion>
		<ns0:tibcoType>MapperActivity</ns0:tibcoType>
		<ns0:muleType>transform-message</ns0:muleType>
		<ns0:conversionImpl>Y</ns0:conversionImpl>
	</ns0:conversion>
	<ns0:conversion>
		<ns0:tibcoType>FileReadActivity</ns0:tibcoType>
		<ns0:muleType>File</ns0:muleType>
		<ns0:conversionImpl>Y</ns0:conversionImpl>
	</ns0:conversion>
	<ns0:conversion>
		<ns0:tibcoType>FileWriteActivity</ns0:tibcoType>
		<ns0:muleType>File</ns0:muleType>
		<ns0:conversionImpl>Y</ns0:conversionImpl>
	</ns0:conversion>
	<ns0:conversion>
		<ns0:tibcoType>FileCreateActivity</ns0:tibcoType>
		<ns0:muleType>File</ns0:muleType>
		<ns0:conversionImpl>Y</ns0:conversionImpl>
	</ns0:conversion>
	<ns0:conversion>
		<ns0:tibcoType>FileRemoveActivity</ns0:tibcoType>
		<ns0:muleType>File</ns0:muleType>
		<ns0:conversionImpl>Y</ns0:conversionImpl>
	</ns0:conversion>
	<ns0:conversion>
		<ns0:tibcoType>AssignActivity</ns0:tibcoType>
		<ns0:muleType>variable-transformer</ns0:muleType>
		<ns0:conversionImpl>Y</ns0:conversionImpl>
	</ns0:conversion>
	<ns0:conversion>
		<ns0:tibcoType>WriteToLogActivity</ns0:tibcoType>
		<ns0:muleType>logger</ns0:muleType>
		<ns0:conversionImpl>Y</ns0:conversionImpl>
	</ns0:conversion>
	<ns0:conversion>
		<ns0:tibcoType>GenerateErrorActivity</ns0:tibcoType>
		<ns0:muleType>N/A</ns0:muleType>
		<ns0:conversionImpl>N</ns0:conversionImpl>
	</ns0:conversion>
	<ns0:conversion>
		<ns0:tibcoType>JavaActivity</ns0:tibcoType>
		<ns0:muleType>custom-transformer~component</ns0:muleType>
		<ns0:conversionImpl>Y</ns0:conversionImpl>
	</ns0:conversion>
</ns0:ConversionInfo>